{
  "_schema": "partner",
  "_id": "3fa85f64-5717-4562-b3fc-2c963f66afa6",
  "_org": "123",
  "_title": "Entity Title",
  "_tags": [
    "family:label"
  ],
  "_purpose": [
    "7675dc56-fd1b-46ee-9c35-defe0667b32e"
  ],
  "status": "string",
  "company_name_title": "string",
  "description": "string",
  "address": [
    {
      "_tags": [
        "billing"
      ],
      "street": "Hauptstraße",
      "street_number": "123",
      "postal_code": "50668",
      "city": "Cologne",
      "country": "DE",
      "additional_info": "string",
      "company_name": "string",
      "first_name": "string",
      "last_name": "string",
      "salutation": "string",
      "title": "string",
      "coordinates": "50.948484, 6.943147",
      "plot_of_land": "string",
      "plot_area": "string",
      "start_date": "1970-01-01",
      "end_date": "1970-01-01"
    }
  ],
  "customer": {
    "$relation": [
      {
        "entity_id": "123e4567-e89b-12d3-a456-426614174000",
        "_tags": [
          "example"
        ]
      }
    ]
  },
  "email": "user@example.com",
  "phone": "+491234567890",
  "_availability_files": {
    "$relation": [
      {
        "entity_id": "123e4567-e89b-12d3-a456-426614174000",
        "_tags": [
          "example"
        ]
      }
    ]
  },
  "workflows": {
    "primary": {
      "id": "string",
      "definition_id": "string",
      "name": "string",
      "status": "STARTED",
      "assignees": [
        "string"
      ],
      "progress": 0,
      "phases_in_progress": [
        {
          "phase_id": "string",
          "phase_name": "string",
          "phase_progress": 0
        }
      ],
      "last_update_time": "1970-01-01T00:00:00.000Z",
      "upcoming_tasks_assignees": [
        "string"
      ],
      "task_id": "string",
      "task_name": "string",
      "task_assignees": [
        "string"
      ],
      "task_duedate": "1970-01-01T00:00:00.000Z",
      "task_execution_type": "MANUAL",
      "task_status": "UNASSIGNED",
      "phase_id": "string",
      "phase_name": "string",
      "phase_assignees": [
        "string"
      ],
      "phase_progress": 0
    }
  },
  "_files": {
    "$relation": [
      {
        "entity_id": "123e4567-e89b-12d3-a456-426614174000",
        "_tags": [
          "example"
        ]
      }
    ]
  },
  "_created_at": "1970-01-01T00:00:00.000Z",
  "_updated_at": "1970-01-01T00:00:00.000Z",
  "_owners": [
    {
      "org_id": "123",
      "user_id": "456"
    }
  ],
  "_acl": {
    "view": [
      "org:456"
    ],
    "edit": [
      "org:456"
    ],
    "delete": [
      "org:456"
    ]
  },
  "_manifest": [
    "123e4567-e89b-12d3-a456-426614174000"
  ]
}